{
  "format": "kck-qa-recipe-v1",
  "canvas": [
    1024,
    1024
  ],
  "target_anchor": [
    512,
    960
  ],
  "scale": 1.031732100890887,
  "resampling": "LANCZOS",
  "loop": 0,
  "frames": [
    {
      "source": "artifacts/qa/2026-10-06-dinosaur-run-slots/frame-000.png",
      "sha256": "6d7ef87216d91487bf466dd6515eefd9b69461574a1b5e697086bc023e51cd19",
      "anchor": [
        475,
        835
      ],
      "duration_ms": 100
    },
    {
      "source": "artifacts/qa/2026-10-06-dinosaur-run-slots/frame-001.png",
      "sha256": "d98ca3eb9381dbe584936338ade5f5c1620515a338900b0d92a77a806f7b23b2",
      "anchor": [
        449,
        835
      ],
      "duration_ms": 100
    }
  ]
}
