{
  "format": "kck-qa-recipe-v1",
  "canvas": [
    1024,
    1024
  ],
  "target_anchor": [
    512,
    960
  ],
  "scale": 1.0395089760232303,
  "resampling": "LANCZOS",
  "loop": 1,
  "frames": [
    {
      "source": "artifacts/qa/2026-10-06-dinosaur-stumble-retry-slots/frame-000.png",
      "sha256": "b940311201bb42f43025274da5f011f2ead222dfba233bf30bb5df78ef0fef56",
      "anchor": [
        458,
        835
      ],
      "duration_ms": 150
    },
    {
      "source": "artifacts/qa/2026-10-06-dinosaur-stumble-retry-slots/frame-001.png",
      "sha256": "c4d659a225711f8dd3574fcc454e1fb56b2828c97de648908fdb30c0f541246b",
      "anchor": [
        455,
        835
      ],
      "duration_ms": 250
    }
  ]
}
